name,position,company,description,session_title,date,time,location,company_type,company_size,company_hq_address,company_hq_country,company_international
Marcella Wartenbergh,"CEO,",AWWG,"As part of Marcella’s many years of experience in the fashion industry, it is important to highlight her extensive experience at leading apparel company PVH Corp. where she held various senior management positions such as Chief Merchandising & Global Licensing Officer for Calvin Klein, President of PVH Europe and Country Manager of PVH Mexico. Marcella also held global senior management positions for the Tommy Hilfiger brand.
Marcella strongly believes that every business should foster an inspiring culture based on collaboration, flexibility, and inclusivity.",Growth Drivers: Where is global retail growth coming from?,13 May 2025,09:50 - 10:20,Main Stage,Fashion,Not available,Not available,Not available,Not available
Mariëlle Slenders,"Head of Media & Retail Media,",A.S. Watson Benelux,"Since 2007, World Retail Congress has been the premier platform for in-depth research, content and events; driving retail growth and inspiring valuable global connections.",Don’t Leave Money on the Table: Turn your Commerce Business into a Retail Media Profit Engine,13 May 2025,12:10 - 12:50,Track 2,Retail,Not available,Not available,Netherlands,Yes
Marisa Gardini,"Managing Partner and CEO,",Prosper Brands,"Before founding Prosper Brands, Marisa launched BCL-ED, LLC, a successful fashion and retail partnership with Ellen DeGeneres and Michael Francis, which has generated over $500 million in cumulative sales to date. Her tenure as Managing Partner and CEO of Isaac Mizrahi was marked by groundbreaking achievements, including the launch of one of the largest brands on QVC and the iconic Isaac Mizrahi for Target collection—pioneering designer collaborations with major retailers. Marisa also played a pivotal role in the relaunch of Liz Claiborne as Creative Director, revitalizing the brand for mid-tier and international retail markets.",Luxury,14 May 2025,17:00 - 17:30,Main Stage,Not available,Not available,Not available,Not available,Not available
Mark Conway,"COO, Kuwait, Oman, Bahrain & Kuwait,",Landmark Retail,"Since 2007, World Retail Congress has been the premier platform for in-depth research, content and events; driving retail growth and inspiring valuable global connections.",International Expansion in a Changing World,13 May 2025,14:40 - 15:40,40 Crystal Palace Suite,Retail,"55,000 employees","Oasis Centre, Al Quoz, Dubai, United Arab Emirates",United Arab Emirates,Yes
Mark W. Baum,"Chief Collaboration & Commercial Officer & SVP, Industry Relations,",FMI - The Food Industry Association,"Mark Baum serves on the Board of Directors of KeyImpact Sales & Systems, a national foodservice broker in the United States. He is an Industry Venture Partner (IVP) with Loft Growth Partners, a private-equity firm, providing growth capital and industry expertise to emerging branded consumer products businesses. To promote diversity initiatives, Baum is a Founding Champion of the NextUp, a CPG/Retail industry organization dedicated to providing career opportunities for women and minorities. Baum also is a Director on the Board of Oswego State University (NY), his alma mater.",Winning with the circular economy – and building better businesses,14 May 2025,12:10 - 12:50,Track 1,Non-profit organization,51-200 employees,"2345 Crystal Drive, Suite 800, Arlington, VA 22202, United States",United States,No
Matthew Shay,"President & CEO,",National Retail Federation (NRF),"Since 2007, World Retail Congress has been the premier platform for in-depth research, content and events; driving retail growth and inspiring valuable global connections.",Not available,12th - 14th May 2025,Not available,Not available,Retail,51-200 employees,"1101 New York Ave NW, Washington, DC 20005, United States",United States,No
Meimei Ding,"Founder,",DFO International,"Since 2007, World Retail Congress has been the premier platform for in-depth research, content and events; driving retail growth and inspiring valuable global connections.",How to unlock the potential for international growth,14 May 2025,14:00 - 14:40,Track 3,Retail,Not available,Not available,Not available,Not available
Michael Roth,"SVP International,",Fabletics,"Since 2007, World Retail Congress has been the premier platform for in-depth research, content and events; driving retail growth and inspiring valuable global connections.",International Expansion in a Changing World,13 May 2025,14:40 - 15:40,40 Crystal Palace Suite,Retail,500-1000 employees,"800 Apollo St, El Segundo, CA 90245, United States",United States,Yes
Michelle Lau,"Managing Director, France,",Alibaba.com,"She joined Alibaba Group in 2016 as Senior Business Development Manager and in 2020, took on a key role in the Senior Strategic Partnership team, overseeing key strategic accounts for various digital solutions. Since 2022 - and until the restructuring of the Group in 2023 - she held the position of co-Managing Director, Alibaba Group before taking over as MD for Alibaba.com in France.",Leading the AI Revolution,13 May 2025,16:10 - 16:40,Main Stage,Technology,"Over 100,000 employees","969 West Wen Yi Road, Yu Hang District, Hangzhou, Zhejiang, China",China,Yes
Nadine Graf,"President, EMEA, UK&I and Emerging Markets,","The Estée Lauder Companies, Inc.","Nadine Graf is President, EMEA, UK & Ireland, and Emerging Markets. In this expanded role for her, she oversees the Company’s strategic growth and transformation across Europe, the Middle East, Africa, India, and emerging markets in Southeast Asia, focused on driving market expansion, omnichannel acceleration, and operational excellence across 100+ markets. The evolution of the geographic scope was designed to help the Company unlock greater synergies, enhance operational efficiencies, and accelerate locally relevant innovation in high-growth markets poised for long-term success.",Shaping the Retail Industry Through the Future of the Consumer,14 May 2025,09:50 - 10:20,Main Stage,Cosmetics,"Over 60,000 employees","767 Fifth Avenue, New York, NY 10153, USA",United States,Yes
Oliver Vernon-Harcourt,"Partner | UK Retail Leader,",Deloitte,"Ol leads Deloitte’s Retail practice in the UK across the firm’s services of Audit & Assurance, Consulting, Financial Advisory, Risk Advisory and Tax & Legal. Prior to this, he led Deloitte’s Retail Consulting practice, working with both business and technology leadership to design and deliver strategic change to embrace digital, enable growth and improve efficiency. Ol is also one the firm’s leaders in retail eminence, from Retail Trends and the Deloitte Consumer Tracker to providing insight on profitability, connected supply chain and innovation in retail. He is passionate about retail and has worked across fashion, department stores, supermarkets, DIY and electrical sectors for over 20 years.",Shaping the Retail Industry Through the Future of the Consumer,14 May 2025,09:50 - 10:20,Main Stage,Professional Services,"Over 415,000 employees","30 Rockefeller Plaza, New York, NY 10112, United States",United States,Yes
Pallak Seth,"Executive Vice Chairman,",PDS Ltd.,"Pallak Seth is a serial entrepreneur and the Founder of PDS. With over 20 years of experience in fashion manufacturing, sourcing, and the investment ecosystem, he is passionate about innovation, sustainability, technology, and entrepreneurship.",Overcoming Sourcing and Supply Chain Challenges in a Volatile World,14 May 2025,14:40 - 15:20,Track 2,Fashion Manufacturing and Sourcing,Not available,Not available,India,Yes
Pareiya Gupta,"Head of Product and Strategy for gStore,",GreyOrange,"Pareiya Gupta is the Head of Product & Strategy for gStore at GreyOrange, where she leads the Go-to-Market strategy and product vision for the company’s in-store automation solution. With over a decade of experience in product management and more than seven years at GreyOrange, Pareiya has successfully taken multiple products from concept to scale - focusing on innovation, usability, and business impact. She has worked closely with some of the world’s largest retailers to modernize in-store execution, build intelligent inventory systems, and drive omnichannel success.",Where AI Meets the Aisle – Because Every Shopper Deserves a Personal Touch,13 May 2025,12:50 - 13:50,50 Crystal Palace Suite,Technology,1001-5000 employees,"Building 101, Candor TechSpace, Tikri, Sector 48, Gurugram, Haryana 122018, India",India,Yes
Patrick Chalhoub,"Executive Chairman,",Chalhoub Group,"Since 2007, World Retail Congress has been the premier platform for in-depth research, content and events; driving retail growth and inspiring valuable global connections.",A Legacy Conversation with Patrick Chalhoub,13 May 2025,15:50 - 16:10,Main Stage,Retail,"12,000 employees","Jebel Ali, Street 22, Dubai, United Arab Emirates",United Arab Emirates,Yes
Patrick Lasfargues,"VP International Partnerships,",Carrefour Group,"Since 2007, World Retail Congress has been the premier platform for in-depth research, content and events; driving retail growth and inspiring valuable global connections.",How to unlock the potential for international growth,14 May 2025,12:40 - 13:20,Track 2,Retail,"321,383 employees","33 Avenue Émile Zola, 92100 Boulogne-Billancourt, France",France,Yes
Paul O'Hara,"CPO and Property Director,",Halfords,"Since 2007, World Retail Congress has been the premier platform for in-depth research, content and events; driving retail growth and inspiring valuable global connections.",Why Inclusive Leadership Matters More Than Ever,14 May 2025,11:30 - 12:10,Track 1,Retail,"Approximately 10,000 employees","Icknield Street Drive, Washford West, Redditch, Worcestershire, B98 0DE, United Kingdom",United Kingdom,No
Paul Wright,"Head of Uber Advertising International,",Uber,"Paul started his career at Sky, where he moved from TV sales into the commercial web. He later co-founded a sports focussed ad network and held a variety of digital roles at Bauer and AOL. He was appointed as the first Chief Digital Officer for OMD Group UK and then Omnicom Media Group UK.",Creating special discovery moments for customers,14 May 2025,11:30 - 12:10,Track 2,Technology,"32,800 employees","1515 3rd Street, San Francisco, CA 94158, United States",United States,Yes
Paula Coughlan,"Chief People, Communications and Sustainability Officer,",Currys,"Before joining Currys, Paula held several leadership roles at McDonald's. Most recently, she was Global Chief People Strategy Officer, where she was responsible for nearly two million colleagues and had a global remit that spanned the business' youth opportunity programme, employer reputation, digital engagement, change management, organisational design and people analytics and insight. Prior to this, Paula was Chief People Officer for Europe and the International Lead Markets. Before her career at McDonald's, Paula held a range of senior people roles at PepsiCo in the UK and Europe.",Winning with the circular economy – and building better businesses,14 May 2025,12:10 - 12:50,Track 1,Retail,"Approximately 36,000 employees","1 Portal Way, London, W3 6RS, United Kingdom",United Kingdom,Yes
Peter Ruis,"Managing Director,",John Lewis Partnership,"Since 2007, World Retail Congress has been the premier platform for in-depth research, content and events; driving retail growth and inspiring valuable global connections.",Don’t Leave Money on the Table: Turn your Commerce Business into a Retail Media Profit Engine,13 May 2025,12:10 - 12:50,Track 2,Retail,"80,000 employees","171 Victoria Street, London SW1E 5NN, United Kingdom",United Kingdom,No
Rami Baitiéh,"CEO,",Morrisons,"Since 2007, World Retail Congress has been the premier platform for in-depth research, content and events; driving retail growth and inspiring valuable global connections.","Rami Baitieh, CEO, Morrisons",14 May 2025,16:20 - 16:40,Main Stage,Retail,"110,000 employees","Hilmore House, Gain Lane, Bradford, BD3 7DL",United Kingdom,No
Regis Schultz,"CEO,",JD Sports,"Since 2007, World Retail Congress has been the premier platform for in-depth research, content and events; driving retail growth and inspiring valuable global connections.","Regis Schultz, CEO, JD Sports 13-May-2025 10:20 – 10:40 Main Stage Keynote Interview: Britt Olsen, Chief Commercial Officer, On",13 May 2025,15:10 - 15:30,Main Stage,Retail,"Approximately 60,000 employees","Hollinsbrook Way, Pilsworth, Bury, BL9 8RR, United Kingdom",United Kingdom,Yes
Reid Nakou,"Chief Experience Officer & Head of Design,",The General Store,"With an immense passion for working with both brands and property owners, Reid’s skillset enables an unlocking of value across a multitude of disciplines and sectors - creating innovative experiences for brands, designing the environments they reside within, and establishing an inspiring strategy to stitch it all together. This philosophy, paired with a love of lateral thinking, informs a unique approach to design, one deeply rooted in customer experience, blue sky thinking and world class architectural concepts.",The World's Coolest Retailers 2025,14 May 2025,14:00 - 14:20,Track 3,Not available,Not available,Not available,Not available,Not available
René Van Dijk,"Director, Digital Strategy and Analytics,",ASICS,"Since 2007, World Retail Congress has been the premier platform for in-depth research, content and events; driving retail growth and inspiring valuable global connections.",How Retail & Brand Leaders are Building Connected Consumer Experiences with Data and AI,13 May 2025,11:30 - 12:10,Track 2,Sportswear and Equipment,"Approximately 9,000 employees","7-1-1, Minatojima-Nakamachi, Chuo-ku, Kobe, Hyogo 650-8555, Japan",Japan,Yes
Reniera O'Donnell,"Executive Lead,",Ellen MacArthur Foundation,"Since 2007, World Retail Congress has been the premier platform for in-depth research, content and events; driving retail growth and inspiring valuable global connections.",Winning with the circular economy – and building better businesses,14 May 2025,14:20 - 14:50,Track 1,Non-profit organization,51-200 employees,"The Sail Loft, 42 Medina Road, Cowes, PO31 7BX, United Kingdom",United Kingdom,Yes
Richard Baker,"Executive Chairman,",Saks Global,"Richard A. Baker is an experienced executive and established visionary with a reputation for capitalizing on opportunities that lie at the intersection of retail and real estate. Mr. Baker currently serves as Executive Chairman of Saks Global, the largest multi-brand luxury retailer in the world, comprising Neiman Marcus, Bergdorf Goodman, Saks Fifth Avenue, Saks OFF 5TH and a $7 billion Gross Asset Value portfolio of real estate assets in top markets across the U.S. Mr. Baker led the highly anticipated acquisition of Neiman Marcus Group and established Saks Global. He is an owner of National Realty & Development Corporation (NRDC), one of the largest real estate development companies in the United States. Mr. Baker previously served as the Chairman of the Board of Directors for Retail Opportunity Investments Corporation (ROIC), after he converted the company into the NASDAQ-listed REIT focused on acquiring retail properties on the west coast of the United States. ROIC was acquired by Blackstone Real Estate for $4 billion in 2025.",30 Main Stage The Power Interview,14 May 2025,09:05 - 09:30,Main Stage,Retail,Not available,"225 Liberty Street, New York, NY 10281, USA",United States,Yes
Richard Bayer,"Executive Vice President, Country Manager and Head of Sales, UK,",Clearpay,"Before relocating to London in March 2021 to take up his current role, Rich was based in San Francisco, where he was EVP of Client Success at Afterpay for two years. In that role he built the Client Success team from the ground up and oversaw all of the key retail relationships. He has been with the company for nearly six years.",The Gen Z Consumer - Insights and Buying Habits,14 May 2025,12:50 - 13:50,50 Crystal Palace Suite,Financial Technology,1001-5000 employees,Not available,Australia,Yes
Roisin Currie,"Chief Executive,",Greggs,"Since 2007, World Retail Congress has been the premier platform for in-depth research, content and events; driving retail growth and inspiring valuable global connections.",how to learn from challenger brands and to adopt a different way of connecting with customers,14 May 2025,14:00 - 14:40,Track 2,Food Retail,"25,000 employees","Greggs House, Quorum Business Park, Newcastle upon Tyne, NE12 8BU, United Kingdom",United Kingdom,No
Rolf Schumann,"CEO,",Schwarz Digits,"Since 2007, World Retail Congress has been the premier platform for in-depth research, content and events; driving retail growth and inspiring valuable global connections.",00 Main Stage Retail in an Uncertain Time,13 May 2025,10:40 - 11:00,Main Stage,Not available,Not available,Not available,Not available,Not available
Romy Miller,"Chief Marketing Officer,",Knoops,"Romy joined Knoops in 2024 to realise the ambition of creating a new category: doing for chocolate drinks what has been done for barista coffee. Before Knoops, Romy was Global Brand Director at KellyDeli, an artisan sushi concept with 1,200 retail locations and DTC e-commerce across the UK, Europe, LatAm and Dubai. From 2013-2021, Romy was Marketing & Commercial Director at GAIL’s Bakery, known for crafting category-defining brand love.",Growing Disruptive Retail Brands,13 May 2025,14:00 - 14:40,Track 1,Food & Beverage,11-50 employees,Not available,United Kingdom,No
Roy Horgan,"CEO UK & Ireland & SEVP Strategy, Marketing & Communications,",VusionGroup,"Since 2007, World Retail Congress has been the premier platform for in-depth research, content and events; driving retail growth and inspiring valuable global connections.","AI-Driven, People-Powered, Store-Centric",14 May 2025,12:10 - 12:50,Track 2,Not available,Not available,Not available,Not available,Not available
Sandra Stanley,"Chief Data Science Officer,",dunnhumby,"Sandra Stanley, Chief Data Science Officer at dunnhumby, leads innovation in AI and data science to drive customer-first retail solutions. With over 25 years’ experience in data science and AI, she specialises in turning data into tangible value for retailers. A recognised industry leader, she was DataIQ Global Data and Analytics Leader of the Year in 2023, and recently took home the 2025 Everywoman in Technology Leader Award.",AI’s real-world impact on retail,13 May 2025,15:00 - 15:20,Track 2,Customer Data Science,2000+ employees,"184 Shepherds Bush Road, London W6 7NL, United Kingdom",United Kingdom,Yes
Scott Price,"Group Chief Executive,",DFI Retail Group,"Since 2007, World Retail Congress has been the premier platform for in-depth research, content and events; driving retail growth and inspiring valuable global connections.",Growth Drivers: Where is global retail growth coming from?,13 May 2025,17:20 - 17:40,Main Stage,Retail,"Approximately 230,000 employees","21st Floor, Devon House, Taikoo Place, 979 King's Road, Quarry Bay",Hong Kong,Yes
Sean Biddick,"Managing Director and Partner,",BCG,"Since 2007, World Retail Congress has been the premier platform for in-depth research, content and events; driving retail growth and inspiring valuable global connections.",Tech-Enabled Teams,13 May 2025,11:30 - 12:30,Track 3,Management Consulting,"25,000+ employees","Exchange Place, 31 St James Ave, Boston, MA 02116, USA",United States,Yes
Selvane Mohandas du Ménil,"Managing Director ,",International Association of Department Stores,"His extensive experience in business development combined with his current position, where he is exchanging on a regular basis with the CEOs of the top department stores in the world, allow him to have an expert understanding of retail and most specifically of the trends, challenges and solutions, in the exciting world of department stores.","Winning ways of delivering experience, service and building loyalty",13 May 2025,11:00 - 11:30,Track 3,Retail Association,Not available,Not available,Not available,Yes
Sharmila Murat,"Director,",Agthia Group,"Previously, Sharmila spent nearly fourteen years with the Chalhoub Group, where she led multiple luxury, fashion, and beauty businesses, drove digital transformation, and launched new brands and concepts. In her last role, she served as Chief Investment Officer and represented the group as a director on several company boards.",International Expansion in a Changing World,13 May 2025,14:40 - 15:40,40 Crystal Palace Suite,Food & Beverage,2000+ employees,"Sky Tower, Al Reem Island, P.O. Box 37725, Abu Dhabi",United Arab Emirates,Yes
Simon Dyer,"Regional Vice President,",Mirakl,"Simon Dyer joined Mirakl five years ago and as RVP EMEA North and VP EMEA Sales Engineering, he plays a critical role in expanding Mirakl's business outside its core geographies and driving business growth by leading a qualified pre-sales function. Simon’s career includes experiences at Siebel, Oracle and Zuora, spanning positions in customer success, consulting, pre-sales and sales. His comprehensive understanding of both pre- and post-sales environments, combined with his experience in shaping sales strategies and building successful teams, makes him a vital asset to Mirakl's continued growth and success.","The Engine Behind eCommerce Growth - Extending your Assortment Online, Profitably",14 May 2025,12:50 - 13:50,Not available,Technology,800+ employees,"40 Avenue de la Grande Armée, 75017 Paris, France",France,Yes
Simon Pakenham-Walsh,"Chief Information Officer,",River Island,"Simon Pakenham-Walsh is the Chief Information Officer at River Island, looking after technology and data at one of the UK’s most iconic retail brands with over 240 stores.",How Retail & Brand Leaders are Building Connected Consumer Experiences with Data and AI,13 May 2025,11:30 - 12:10,Track 2,Retail,3000+ employees,"Chelsea House, Westgate, London, W5 1DR, United Kingdom",United Kingdom,Yes
Simon Vincent OBE,"EVP & President EMEA,",Hilton,"Vincent has more than three decades of experience in hospitality and tourism, previously serving as CEO of Opodo, the pan-European online travel agency and COO of Thomas Cook Travel. He spent the early part of his career in International Banking with HSBC and has extensive international experience having also worked in North America and Japan. From 2014-2023 he served as non-executive director at iconic London retailer Fortnum & Mason.",Winning Customer Experience from Beyond Retail,14 May 2025,14:00 - 14:40,Track 1,Hospitality,"About 141,000 employees","7930 Jones Branch Drive, McLean, VA 22102, USA",United States,Yes
Sir Terry Leahy,"Senior Advisor,","Clayton, Dubilier & Rice","Since 2007, World Retail Congress has been the premier platform for in-depth research, content and events; driving retail growth and inspiring valuable global connections.","Driving Growth in PE, VC or PLCs",13 May 2025,14:00 - 14:40,Track 2,Private Equity,Not available,"375 Park Avenue, 18th Floor, New York, NY 10152, USA",United States,Yes
Sjoerd Holleman,"SVP Strategy, Product & Analytics,",Albert Heijn,"Since 2007, World Retail Congress has been the premier platform for in-depth research, content and events; driving retail growth and inspiring valuable global connections.",Shaping the Retail Industry Through the Future of the Consumer,14 May 2025,09:50 - 10:20,Main Stage,Retail,"100,000+ employees","Provincialeweg 11, 1506 MA Zaandam, Netherlands",Netherlands,No
Sonia Abrahams,"Director, Insight,",Brunswick Group,"Over the course of her 20-year career, Sonia has used insight to develop and inform messaging and strategy across a range of complex and politically charged reputational issues, including post Brexit trade issues, airport expansion, health and pensions reform. Sonia has advised clients including Prudential, Heathrow and Google, as well as various UK Government departments such as the Department for International Trade.",AI in Retail: The Customer’s Perspective,14 May 2025,16:40 - 17:00,Main Stage,Public Relations and Communications,1001-5000 employees,"16 Lincoln's Inn Fields, London WC2A 3ED, United Kingdom",United Kingdom,Yes
Stefan Vanoverbeke,"Retail Markets Manager,",Ingka Group (IKEA),"Since 2007, World Retail Congress has been the premier platform for in-depth research, content and events; driving retail growth and inspiring valuable global connections.",Growth Drivers: Where is global retail growth coming from?,13 May 2025,09:50 - 10:20,Main Stage,Retail,"Approximately 225,000 employees","Olof Palmestraat 1, 2616 LN Delft, Netherlands",Netherlands,Yes
Suzanne Long,"Former Chief Sustainability and Transformation Officer,",Albertsons,"Suzanne joined the “new” Albertsons Companies in 2012, leading five major acquisitions/integrations that grew the company to the second largest food and drug retailer in the US. In 2017 she was additionally given the assignment of delivering $500M in cost savings over a three-year timeframe. Suzanne became Group Vice President, Strategic Sourcing and Sustainability in 2020, and has since been named the company’s first Chief Sustainability and Transformation Officer, responsible for driving both the company’s ESG strategy (“Recipe for Change”) and a variety of enterprise-wide strategic initiatives.",Winning with the circular economy – and building better businesses,14 May 2025,16:00 - 16:30,Track 1,Retail,"300,000 employees","250 Parkcenter Blvd, Boise, ID 83706, United States",United States,No
