name,position,company,description,session_title,date,time,location,company_type,company_size,company_hq_address,company_hq_country,company_international
Suzy McClintock,"VP, New Verticals,",Deliveroo,"Suzy is the Vice President for new verticals at Deliveroo, leading grocery and retail for the company. In her role, she is responsible for the full strategy, operations and commercial executions of these fast-growing business units across multiple verticals. Before joining Deliveroo in 2021, Suzy spent over 4 years in various commercial, product and strategy roles at Amazon.",Quick Commerce,13 May 2025,12:10 - 12:30,Track 1,Food delivery,2000-5000 employees,"The River Building, 1 Cousin Lane, London, EC4R 3TE, United Kingdom",United Kingdom,Yes
Tasia Filippatos,"President,",Disney Consumer Products,"Tasia Filippatos is the President of Disney Consumer Products, the global retail division of The Walt Disney Company. This division includes the world’s largest licensing business with $62 billion in annual retail sales, the top children’s publishing brand and one of the leading games licensors. It is also comprised of the global Disney Store business and hundreds of shopping destinations at Disney’s theme parks.",Future of Physical Retailing,13 May 2025,17:00 - 17:30,Main Stage,Retail,Not available,"500 South Buena Vista Street, Burbank, CA 91521, USA",United States,Yes
Thomas Dijkman,"Retail Business Consultant ,",Q&A Retail,"Thomas Dijkman is Retail Business Consultant at Q&A Retail and Co-chair of the “Young Ebeltoft” initiative — a global collective of next-gen retail thinkers part of the Ebeltoft Group. He specializes in translating insights, expertise, and creativity into solutions that help leading retailers adapt and thrive in a fast-changing landscape. Thomas has worked with retailers such as SPAR, Nexeye, and Action, advising on strategy, consumer engagement and store concept optimization. At this year’s conference, he co-hosts a session on Gen Z and Gen Alpha, spotlighting exclusive research from Young Ebeltoft. With a no-nonsense, data-driven approach, Thomas helps retailers understand what young consumers and employees want — and how to meet them there.",The Next Generations in Retail: Gen Z and Gen Alpha as Employee and Consumer,14 May 2025,14:40 - 15:40,40 Crystal Palace Suite,Retail,Not available,Not available,Not available,Yes
Thomas Harms,"Co-founder and Chairman,",NET4BOARDS,"Thomas founded NET4BOARDS, an innovative & sophisticated Strategy Consulting Ecosystem. As rethinking strategies are now more important and challenging than ever before, he enables his clients to find their North Star, achieve unique insights and experiences, set long-term Strategy Goals and to decide what to do when.",How to deliver growth and resilience as a New World Order emerges,13 May 2025,08:00 - 09:00,Track 3,Strategy Consulting,Not available,Not available,Not available,No
Tim Danaher,"Partner, Consumer Industries Group Global Lead,",Brunswick Group,"Since 2007, World Retail Congress has been the premier platform for in-depth research, content and events; driving retail growth and inspiring valuable global connections.",AI in Retail: The Customer’s Perspective,14 May 2025,14:50 - 15:10,Main Stage,Public Relations and Communications,501-1000 employees,"16 Lincoln's Inn Fields, London, WC2A 3ED, United Kingdom",United Kingdom,Yes
Tim Steiner,"CEO,",Ocado,"Since 2007, World Retail Congress has been the premier platform for in-depth research, content and events; driving retail growth and inspiring valuable global connections.",Growth Drivers: Where is global retail growth coming from?,13 May 2025,09:50 - 10:20,Main Stage,Technology,"19,000 employees","Buildings One & Two, Trident Place, Mosquito Way, Hatfield, Hertfordshire, AL10 9UL",United Kingdom,Yes
Tjeerd Jegen,"Chair of Supervisory Board,",Accell Group,"In 2015, Jegen started his career in private equity and became CEO of variety value chain HEMA, focusing on international growth and sustainability. In 2022, he joined Takko Fashion as CEO, leading its expansion and digital transformation. Since November 2023, he has been CEO of Accell Group, the leading European bicycle manufacturer. In April 2025, he transitioned to Chairman of the Supervisory Board.","Driving Growth in PE, VC or PLCs",13 May 2025,14:00 - 14:40,Track 2,Bicycle Manufacturing,"Approximately 3,100 employees","Industrieweg 4, 8444 AR Heerenveen, Netherlands",Netherlands,Yes
Tjeerd van der Zee,"Managing Director,",NET4BOARDS,"A Dutch citizen with a distinguished career in retailing, real-estate and banking, Tjeerd is a transformative leader whose insights have shaped the industry. For over 20 years, Tjeerd served on the management board of the C&A-Group, one of Europe’s largest apparel retail chains, excelling in diverse leadership roles, including CFO, COO, and CEO of C&A Germany. During this time, he played a pivotal role in driving the company’s strategic direction, operational excellence, and growth and expansion across European markets.",How to deliver growth and resilience as a New World Order emerges,13 May 2025,07:45 - 08:45,45 Crystal Palace Suite,Not available,Not available,Not available,Not available,Not available
Todd Snyder,"Founder,",Todd Snyder,"Since 2007, World Retail Congress has been the premier platform for in-depth research, content and events; driving retail growth and inspiring valuable global connections.","Todd Snyder, Founder, Todd Snyder",14 May 2025,10:20 - 10:40,Main Stage,Retail,51-200 employees,"242 Elizabeth St, New York, NY 10012, United States",United States,No
Tommy Resin,"Head of Digital Business,",Stadium,"Tommy Resin has a diverse work experience in various roles and companies. Tommy started their career as a Mystery Shopper at GAPbuster Worldwide in 2006. Tommy then worked as a Store Manager at Stadium from 2006 to 2009. From 2009 to 2014, Tommy served as the Marketing and Communications Manager for Västerbottens idrottsförbund & SISU idrottsutbildarna. In 2014, they returned to Stadium as a Store Manager, and later held positions such as E-Commerce Manager, Commercial Manager Online, and Head of Commercial. Tommy's most recent role at Stadium is Head of Digital Business. Tommy is responsible for driving and developing e-commerce for various brands within the Stadium Group, as well as managing the marketplace business model. Overall, Tommy's work experience demonstrates their expertise in e-commerce, marketing, and management.","The Engine Behind eCommerce Growth - Extending your Assortment Online, Profitably",14 May 2025,12:50 - 13:50,Not available,Retail,Not available,"Arenavägen 63, 121 77 Johanneshov, Sweden",Sweden,No
Tracey Clements,"Retail Executive,",Formerly bp/Boots/Tesco,"Tracey recently moved on from her role as SVP for bp’s vast European retail business, after four years in role. Prior to bp, Tracey was COO at Boots, where she led the UK and ROI operations during the COVID-19 pandemic, and Tesco PLC, where she drove significant improvements in convenience market share, operating margins, and customer propositions as MD of Tesco Express and CEO of One Stop Stores Ltd.",Why Inclusive Leadership Matters More Than Ever,14 May 2025,11:30 - 12:10,Track 1,Not available,Not available,Not available,Not available,Not available
Tracy Bay,"SVP, Head of eCommerce & Strategy,",J.Crew Group,"Tracy Bay is the Head of Strategy and Ecommerce at J.Crew Group, where she leads ecommerce, digital marketing, loyalty & retention for J.Crew and its Factory business, in addition to overseeing corporate strategy and consumer insights across the company’s portfolio of brands. She is focused on driving growth in key areas of the business while developing both brand and corporate strategies to unlock long-term value creation.  Her specialty is analyzing and translating customer behavior into impactful business strategies, ensuring the brands remain relevant and continue to grow in an ever-evolving market.",Leading the AI Revolution,13 May 2025,16:10 - 16:40,Main Stage,Retail,"10,001+ employees","225 Liberty Street, New York, NY 10281, United States",United States,Yes
Tristia Harrison DBE,"Chair / NED,",NEXT,"Chief Executive Officer TalkTalk Group PLC from 2017-2024; the UK's only scale challenger ISP.

Led the relocation of the TalkTalk HQ to Salford Greater Manchester in 2018. In 2023/4 led the demerger of the Group to create TalkTalk Consumer, and PXC (UK's fastest growing B2B Telecoms Platform).

Prior to CEO various senior management positions at The Carphone Warehouse, Best Buy Mobile and TalkTalk Group PLC from 2000-2017. Including CMO, Managing Director Consumer, Marketing Director. I joined the TTG PLC Board as an Executive Director in 2014.

Independent Non-Executive Director at NEXT PLC 2018 to present. Member of Audit, Rem and Nomination committees.

Chair of the Board of Trustees of national homelessness charity Crisis 2020 to present.

Previously spent 10 years as Trustee at Comic Relief and remain an honorary Trustee at Ambitious about Autism.

Humbled receive a DBE for services to Telecommunications in the 2024 New Year honours list.",Why Inclusive Leadership Matters More Than Ever,14 May 2025,11:30 - 12:10,Track 1,Retail,"25,000+ employees","Desford Road, Enderby, Leicester, LE19 4AT",United Kingdom,Yes
Victoria Jenkins,"Founder and CEO,",Unhidden,"Since 2007, World Retail Congress has been the premier platform for in-depth research, content and events; driving retail growth and inspiring valuable global connections.",Growing Disruptive Retail Brands,13 May 2025,14:00 - 14:40,Track 1,Fashion,Not available,Not available,United Kingdom,No
Wern-Yuen Tan,"Partner,",Hillhouse Investment,"Wern-Yuen (“Yuen”) Tan is a Partner at Hillhouse Investment, where he leads the firm’s consumer and retail investments practice globally. Before joining Hillhouse in 2025, Yuen held the position of Chief Commercial Officer at PepsiCo and served as its APAC CEO for the Asia Pacific, including Australia, New Zealand and China. In these roles, he spearheaded strategic growth initiatives as well as worked closely with market teams and strategic channel partners to enhance and expand PepsiCo’s Commercial Data & Digital capabilities.",Retail in Asia,14 May 2025,14:25 - 14:45,Track 1,Investment,Not available,"32/F, Tower 1, Times Square, 1 Matheson Street, Causeway Bay",Hong Kong,Yes
